{
  "$schema": "http://json-schema.org/draft-07/schema#",
  "title": "Task Bundle Schema",
  "type": "object",
  "required": [
    "id",
    "version",
    "artifacts",
    "files",
    "tests",
    "checksum"
  ],
  "properties": {
    "id": {
      "type": "string"
    },
    "version": {
      "type": "string",
      "pattern": "^\\d+\\.\\d+\\.\\d+$"
    },
    "artifacts": {
      "type": "array",
      "items": {
        "type": "object",
        "required": [
          "type",
          "path",
          "version"
        ],
        "properties": {
          "type": {
            "type": "string"
          },
          "path": {
            "type": "string"
          },
          "version": {
            "type": "string"
          }
        }
      }
    },
    "files": {
      "type": "array",
      "items": {
        "type": "object",
        "required": [
          "path",
          "checksum"
        ],
        "properties": {
          "path": {
            "type": "string"
          },
          "checksum": {
            "type": "string"
          }
        }
      }
    },
    "tests": {
      "type": "array",
      "items": {
        "type": "string"
      }
    },
    "checksum": {
      "type": "string",
      "description": "Overall bundle checksum"
    }
  }
}